{
  "recording": false,
  "t0": 11220.39999999106,
  "meta": {
    "userAgent": "Mozilla/5.0 (Windows NT 10.0; Win64; x64) AppleWebKit/537.36 (KHTML, like Gecko) Chrome/140.0.0.0 Safari/537.36",
    "viewport": {
      "width": 1920,
      "height": 957
    }
  },
  "steps": [
    {
      "type": "navigate",
      "url": "https://chatgpt.com/",
      "ts": 0
    },
    {
      "type": "click",
      "selector": "#prompt-textarea",
      "offset": {
        "x": 324,
        "y": 15
      },
      "ts": 0.894
    },
    {
      "type": "type",
      "selector": "#prompt-textarea",
      "text": "Hi CHATGPT, ",
      "ts": 2.897
    },
    {
      "type": "type",
      "selector": "#prompt-textarea",
      "text": "how are you? ",
      "ts": 4.516
    },
    {
      "type": "key",
      "selector": "#prompt-textarea",
      "key": "Enter",
      "ts": 4.817
    },
    {
      "type": "click",
      "selector": "[data-testid=\"composer-button-search\"]",
      "offset": {
        "x": 53,
        "y": 27
      },
      "ts": 8.541,
      "fallbacks": [
        "[data-testid=\"composer-button-search\"]",
        "button[aria-label=\"Search\"]"
      ]
    },
    {
      "type": "click",
      "selector": "#prompt-textarea",
      "offset": {
        "x": 132,
        "y": 20
      },
      "ts": 9.232
    },
    {
      "type": "type",
      "selector": "#prompt-textarea",
      "text": "Whats the wat",
      "ts": 11.559
    },
    {
      "type": "type",
      "selector": "#prompt-textarea",
      "text": "Whats the waWhats the weather like in ",
      "ts": 13.366
    },
    {
      "type": "type",
      "selector": "#prompt-textarea",
      "text": "new york right now? ",
      "ts": 15.373
    },
    {
      "type": "key",
      "selector": "#prompt-textarea",
      "key": "Enter",
      "ts": 15.655
    },
    {
      "type": "type",
      "selector": "#prompt-textarea",
      "text": "Tell me about a ",
      "ts": 24.39
    },
    {
      "type": "type",
      "selector": "#prompt-textarea",
      "text": "recent news article? ",
      "ts": 27.925
    },
    {
      "type": "key",
      "selector": "#prompt-textarea",
      "key": "Enter",
      "ts": 28.224
    }
  ],
  "version": 1
}